Provience,District,Local Body,Ward No,Post,Candidate,Party
बागमती प्रदेश,सिन्धुली,कमलामाई नगरपालिका,,उपप्रमुख,सविना मुक्तान,नेपाल कम्युनिष्ट पार्टी (समाजवादी)
बागमती प्रदेश,सिन्धुली,कमलामाई नगरपालिका,,उपप्रमुख,कुमारी मिश्रा खड्का,नेपाली कांग्रेस (बी.पी.)
बागमती प्रदेश,सिन्धुली,कमलामाई नगरपालिका,,उपप्रमुख,मन्जु देवकोटा,नेपाल कम्युनिष्ट पार्टी (एमाले)
बागमती प्रदेश,सिन्धुली,कमलामाई नगरपालिका,,उपप्रमुख,दिर्घ राज श्रेष्ठ,नेपाल कम्युनिष्ट पार्टी (माओवादी केन्द्र)
बागमती प्रदेश,सिन्धुली,कमलामाई नगरपालिका,,उपप्रमुख,सुमित्रा कुमारी ठकुरी,राष्ट्रिय प्रजातन्त्र पार्टी
बागमती प्रदेश,सिन्धुली,कमलामाई नगरपालिका,,उपप्रमुख,मोद नाथ तिमल्सीना,"जनता समाजवादी पार्टी, नेपाल"
