Provience,District,Local Body,Ward No,Post,Candidate,Party
प्रदेश १,इलाम,चुलाचुली गाउँपालिका,,उपाध्यक्ष,सिता कुमारी लावती,संघीय लोकतान्त्रिक राष्ट्रिय मञ्च
प्रदेश १,इलाम,चुलाचुली गाउँपालिका,,उपाध्यक्ष,अनिता लावती,मंगोल नेशनल अर्गनाइजेसन
प्रदेश १,इलाम,चुलाचुली गाउँपालिका,,उपाध्यक्ष,दिल कुमारी लिम्‍बु(योङ्गहाङ्ग),नेपाल कम्युनिष्ट पार्टी (एमाले)
प्रदेश १,इलाम,चुलाचुली गाउँपालिका,,उपाध्यक्ष,शुक बहादुर लावती,नेपाल कम्युनिष्ट पार्टी (माओवादी केन्द्र)
प्रदेश १,इलाम,चुलाचुली गाउँपालिका,,उपाध्यक्ष,छलि माया कुमाल,"जनता समाजवादी पार्टी, नेपाल"
