Provience,District,Local Body,Ward No,Post,Candidate,Party
गण्डकी प्रदेश,गोरखा,गोरखा नगरपालिका,,उपप्रमुख,मन्सु गुरुङ,मंगोल नेशनल अर्गनाइजेसन
गण्डकी प्रदेश,गोरखा,गोरखा नगरपालिका,,उपप्रमुख,देवी बहादुर बस्नेत,नेपाल कम्युनिष्ट पार्टी (एमाले)
गण्डकी प्रदेश,गोरखा,गोरखा नगरपालिका,,उपप्रमुख,मसली माया थोकर पुन,नेपाली काँग्रेस
गण्डकी प्रदेश,गोरखा,गोरखा नगरपालिका,,उपप्रमुख,यादब बहादुर बस्नेत,नेपाल कम्युनिष्ट पार्टी (एकिकृत समाजबादी)
गण्डकी प्रदेश,गोरखा,गोरखा नगरपालिका,,उपप्रमुख,सम्झना लामिछाने,राष्ट्रिय प्रजातन्त्र पार्टी
गण्डकी प्रदेश,गोरखा,गोरखा नगरपालिका,,उपप्रमुख,नारायण खत्री,"जनता समाजवादी पार्टी, नेपाल"
