Provience,District,Local Body,Ward No,Post,Candidate,Party
सुदूरपश्चिम प्रदेश,अछाम,पञ्चदेवल विनायक नगरपालिका,,उपप्रमुख,शर्मिला कुमारी शाही,राष्ट्रिय प्रजातन्त्र पार्टी
सुदूरपश्चिम प्रदेश,अछाम,पञ्चदेवल विनायक नगरपालिका,,उपप्रमुख,कृष्णा कुमार जैसी,नेपाल कम्युनिष्ट पार्टी (एकिकृत समाजबादी)
सुदूरपश्चिम प्रदेश,अछाम,पञ्चदेवल विनायक नगरपालिका,,उपप्रमुख,रिता रावल,नेपाल कम्युनिष्ट पार्टी (माओवादी केन्द्र)
सुदूरपश्चिम प्रदेश,अछाम,पञ्चदेवल विनायक नगरपालिका,,उपप्रमुख,हर्क बहादुर रावल,नेपाली काँग्रेस
सुदूरपश्चिम प्रदेश,अछाम,पञ्चदेवल विनायक नगरपालिका,,उपप्रमुख,राजु संज्याल,नेपाल कम्युनिष्ट पार्टी (एमाले)
