Provience,District,Local Body,Ward No,Post,Candidate,Party
प्रदेश १,ताप्लेजुंग,फुङलिङ नगरपालिका,,उपप्रमुख,अमृता गुरुङ,संघीय लोकतान्त्रिक राष्ट्रिय मञ्च
प्रदेश १,ताप्लेजुंग,फुङलिङ नगरपालिका,,उपप्रमुख,बम बहादुर भट्टराई,नेपाल कम्युनिष्ट पार्टी (माओवादी केन्द्र)
प्रदेश १,ताप्लेजुंग,फुङलिङ नगरपालिका,,उपप्रमुख,प्रदिप मादेन,"जनता समाजवादी पार्टी, नेपाल"
प्रदेश १,ताप्लेजुंग,फुङलिङ नगरपालिका,,उपप्रमुख,भीमादेवी ओझा,नेपाल कम्युनिष्ट पार्टी (एमाले)
प्रदेश १,ताप्लेजुंग,फुङलिङ नगरपालिका,,उपप्रमुख,मोहन गुरुङ्ग,मंगोल नेशनल अर्गनाइजेसन
प्रदेश १,ताप्लेजुंग,फुङलिङ नगरपालिका,,उपप्रमुख,निर्मला इजम थापा,राष्ट्रिय प्रजातन्त्र पार्टी
