Provience,District,Local Body,Ward No,Post,Candidate,Party
कर्णाली प्रदेश,जुम्ला,सिंजा गाउँपालिका,,उपाध्यक्ष,सितली रोकाया,नेपाल कम्युनिष्ट पार्टी (माओवादी केन्द्र)
कर्णाली प्रदेश,जुम्ला,सिंजा गाउँपालिका,,उपाध्यक्ष,कल्पना बुढा,नेपाल कम्युनिष्ट पार्टी (एमाले)
कर्णाली प्रदेश,जुम्ला,सिंजा गाउँपालिका,,उपाध्यक्ष,रुपा रोकाया,राष्ट्रिय प्रजातन्त्र पार्टी
कर्णाली प्रदेश,जुम्ला,सिंजा गाउँपालिका,,उपाध्यक्ष,रणबहादुर रोकया,नेपाल मजदुर किसान पार्टी
कर्णाली प्रदेश,जुम्ला,सिंजा गाउँपालिका,,उपाध्यक्ष,रजन्कला शाही,नेपाली काँग्रेस
कर्णाली प्रदेश,जुम्ला,सिंजा गाउँपालिका,,उपाध्यक्ष,हिमाली भण्डारी (नेपाल),नेपाल कम्युनिष्ट पार्टी (एकिकृत समाजबादी)
