Provience,District,Local Body,Ward No,Post,Candidate,Party
मधेश प्रदेश,सिराहा,नवराजपुर गाउँपालिका,,उपाध्यक्ष,अर्चना कुमारी देवी साह,जनमत पार्टी (जपा)
मधेश प्रदेश,सिराहा,नवराजपुर गाउँपालिका,,उपाध्यक्ष,संगिता कुमारी यादव,नेपाल कम्युनिष्ट पार्टी (एमाले)
मधेश प्रदेश,सिराहा,नवराजपुर गाउँपालिका,,उपाध्यक्ष,हिरा ठाकुर,नेपाल कम्युनिष्ट पार्टी (माओवादी केन्द्र)
मधेश प्रदेश,सिराहा,नवराजपुर गाउँपालिका,,उपाध्यक्ष,पुनम कुमारी यादव,"जनता समाजवादी पार्टी, नेपाल"
मधेश प्रदेश,सिराहा,नवराजपुर गाउँपालिका,,उपाध्यक्ष,शोभा कुमारी यादव,नेपाली काँग्रेस
