Provience,District,Local Body,Ward No,Post,Candidate,Party
प्रदेश १,संखुवासभा,सिलीचोङ गाउँपालिका,,अध्यक्ष,भूपाल राज राई,नेपाली काँग्रेस
प्रदेश १,संखुवासभा,सिलीचोङ गाउँपालिका,,अध्यक्ष,खड्ग नन्द राई,नेपाल कम्युनिष्ट पार्टी (एमाले)
प्रदेश १,संखुवासभा,सिलीचोङ गाउँपालिका,,अध्यक्ष,योगेन्द्र राई,नेपाल कम्युनिष्ट पार्टी (माओवादी केन्द्र)
प्रदेश १,संखुवासभा,सिलीचोङ गाउँपालिका,,अध्यक्ष,कृष्ण बहादुर राई,स्वतन्त्र
प्रदेश १,संखुवासभा,सिलीचोङ गाउँपालिका,,अध्यक्ष,तुला बहादुर राई(कुलुङ),"जनता समाजवादी पार्टी, नेपाल"
