Provience,District,Local Body,Ward No,Post,Candidate,Party
मधेश प्रदेश,रौतहट,माधव नारायण नगरपालिका,,उपप्रमुख,श्रीमती रेणु यादव,नेपाली काँग्रेस
मधेश प्रदेश,रौतहट,माधव नारायण नगरपालिका,,उपप्रमुख,मीना  कुमारी,राष्ट्रिय प्रजातन्त्र पार्टी नेपाल
मधेश प्रदेश,रौतहट,माधव नारायण नगरपालिका,,उपप्रमुख,जमुना देवी,"लोकतान्त्रिक समाजवादी पार्टी, नेपाल"
मधेश प्रदेश,रौतहट,माधव नारायण नगरपालिका,,उपप्रमुख,सिमा देवी यादव,नेपाल कम्युनिष्ट पार्टी (एकिकृत समाजबादी)
मधेश प्रदेश,रौतहट,माधव नारायण नगरपालिका,,उपप्रमुख,विजुवती देवी यादव,नेपाल कम्युनिष्ट पार्टी (माओवादी केन्द्र)
मधेश प्रदेश,रौतहट,माधव नारायण नगरपालिका,,उपप्रमुख,तेज नारायण प्रसाद साह,नेपाल कम्युनिष्ट पार्टी (एमाले)
मधेश प्रदेश,रौतहट,माधव नारायण नगरपालिका,,उपप्रमुख,सरनेशा खातुन,जनमत पार्टी (जपा)
मधेश प्रदेश,रौतहट,माधव नारायण नगरपालिका,,उपप्रमुख,निर्मला देवी रमण,"जनता समाजवादी पार्टी, नेपाल"
