Provience,District,Local Body,Ward No,Post,Candidate,Party
मधेश प्रदेश,बारा,विश्रामपुर गाउँपालिका,,उपाध्यक्ष,गायत्री देवी,नेपाल कम्युनिष्ट पार्टी (एकिकृत समाजबादी)
मधेश प्रदेश,बारा,विश्रामपुर गाउँपालिका,,उपाध्यक्ष,ममता कुमारी,नेपाल कम्युनिष्ट पार्टी (माओवादी केन्द्र)
मधेश प्रदेश,बारा,विश्रामपुर गाउँपालिका,,उपाध्यक्ष,प्रियंका देवी,"लोकतान्त्रिक समाजवादी पार्टी, नेपाल"
मधेश प्रदेश,बारा,विश्रामपुर गाउँपालिका,,उपाध्यक्ष,सुमिंत्रा देवी,नेपाली काँग्रेस
मधेश प्रदेश,बारा,विश्रामपुर गाउँपालिका,,उपाध्यक्ष,प्रियंका कुमारी चौरसिया,"जनता समाजवादी पार्टी, नेपाल"
मधेश प्रदेश,बारा,विश्रामपुर गाउँपालिका,,उपाध्यक्ष,अनिता देवि,राष्ट्रिय प्रजातन्त्र पार्टी
मधेश प्रदेश,बारा,विश्रामपुर गाउँपालिका,,उपाध्यक्ष,अनवरी वेगम,नेपाल कम्युनिष्ट पार्टी (एमाले)
