Provience,District,Local Body,Ward No,Post,Candidate,Party
प्रदेश १,ओखलढुंगा,चम्पादेवी  गाउँपालिका,,अध्यक्ष,कमल वहादुर खड्का,नेपाल कम्युनिष्ट पार्टी (एकिकृत समाजबादी)
प्रदेश १,ओखलढुंगा,चम्पादेवी  गाउँपालिका,,अध्यक्ष,मीत बहादुर लामा मुक्तान,मंगोल नेशनल अर्गनाइजेसन
प्रदेश १,ओखलढुंगा,चम्पादेवी  गाउँपालिका,,अध्यक्ष,खड्ग बहादुर कार्की,नेपाल कम्युनिष्ट पार्टी (एमाले)
प्रदेश १,ओखलढुंगा,चम्पादेवी  गाउँपालिका,,अध्यक्ष,खेम प्रसाद मिश्र,स्वतन्त्र
प्रदेश १,ओखलढुंगा,चम्पादेवी  गाउँपालिका,,अध्यक्ष,झलक मान तामाङ,नेपाल कम्युनिष्ट पार्टी (माओवादी केन्द्र)
प्रदेश १,ओखलढुंगा,चम्पादेवी  गाउँपालिका,,अध्यक्ष,नवराज के.सी(खत्री),नेपाली काँग्रेस
