Provience,District,Local Body,Ward No,Post,Candidate,Party
प्रदेश १,झापा,झापा गाउँपालिका,,उपाध्यक्ष,देवीमाया अधिकारी,नेपाल कम्युनिष्ट पार्टी (एमाले)
प्रदेश १,झापा,झापा गाउँपालिका,,उपाध्यक्ष,तारामाया राई,राष्ट्रिय प्रजातन्त्र पार्टी
प्रदेश १,झापा,झापा गाउँपालिका,,उपाध्यक्ष,अन्जु देवी थपलिया,नेपाली काँग्रेस
प्रदेश १,झापा,झापा गाउँपालिका,,उपाध्यक्ष,मुन्नावती गणेश,नेपाल कम्युनिष्ट पार्टी (माओवादी केन्द्र)
प्रदेश १,झापा,झापा गाउँपालिका,,उपाध्यक्ष,ईश्‍वर प्रसाद दाहाल,नेपाल कम्युनिष्ट पार्टी (एकिकृत समाजबादी)
