Provience,District,Local Body,Ward No,Post,Candidate,Party
बागमती प्रदेश,मकवानपुर,बकैया गाउँपालिका,,उपाध्यक्ष,लाल बहादुर स्याङ्तान,नेपाल कम्युनिष्ट पार्टी (एमाले)
बागमती प्रदेश,मकवानपुर,बकैया गाउँपालिका,,उपाध्यक्ष,सावित्री  राई,राष्ट्रिय प्रजातन्त्र पार्टी
बागमती प्रदेश,मकवानपुर,बकैया गाउँपालिका,,उपाध्यक्ष,मिरा वाईवा,"जनता समाजवादी पार्टी, नेपाल"
बागमती प्रदेश,मकवानपुर,बकैया गाउँपालिका,,उपाध्यक्ष,उर्मिला राई,नेपाल कम्युनिष्ट पार्टी (एकिकृत समाजबादी)
बागमती प्रदेश,मकवानपुर,बकैया गाउँपालिका,,उपाध्यक्ष,भक्त बहादुर खत्री,नेपाल कम्युनिष्ट पार्टी (माओवादी केन्द्र)
