Provience,District,Local Body,Ward No,Post,Candidate,Party
मधेश प्रदेश,महोत्तरी,लोहरपट्टी नगरपालिका,,उपप्रमुख,गिता देवी,"जनता समाजवादी पार्टी, नेपाल"
मधेश प्रदेश,महोत्तरी,लोहरपट्टी नगरपालिका,,उपप्रमुख,सुनीता देवी दास,जनमत पार्टी (जपा)
मधेश प्रदेश,महोत्तरी,लोहरपट्टी नगरपालिका,,उपप्रमुख,सरिता शर्मा,नेपाली काँग्रेस
मधेश प्रदेश,महोत्तरी,लोहरपट्टी नगरपालिका,,उपप्रमुख,शोभा कुमारी यादव,नेपाल कम्युनिष्ट पार्टी (माओवादी केन्द्र)
मधेश प्रदेश,महोत्तरी,लोहरपट्टी नगरपालिका,,उपप्रमुख,वहिदा खातुन,"लोकतान्त्रिक समाजवादी पार्टी, नेपाल"
मधेश प्रदेश,महोत्तरी,लोहरपट्टी नगरपालिका,,उपप्रमुख,मनिषा कुमारी,नेपाल कम्युनिष्ट पार्टी (एकिकृत समाजबादी)
मधेश प्रदेश,महोत्तरी,लोहरपट्टी नगरपालिका,,उपप्रमुख,रेणु कुमारी चौधरी,नेपाल कम्युनिष्ट पार्टी (एमाले)
मधेश प्रदेश,महोत्तरी,लोहरपट्टी नगरपालिका,,उपप्रमुख,राम कुमारी देवी,राष्ट्रिय प्रजातन्त्र पार्टी
