Provience,District,Local Body,Ward No,Post,Candidate,Party
बागमती प्रदेश,नुवाकोट,बेलकोटगढी नगरपालिका,,उपप्रमुख,विष्णु माया पौडेल,आमूल परिवर्तन मसिहा पार्टी नेपाल
बागमती प्रदेश,नुवाकोट,बेलकोटगढी नगरपालिका,,उपप्रमुख,यसोदा दहाल,राष्ट्रिय प्रजातन्त्र पार्टी
बागमती प्रदेश,नुवाकोट,बेलकोटगढी नगरपालिका,,उपप्रमुख,रुपा सापकोटा,नेपाल कम्युनिष्ट पार्टी (एमाले)
बागमती प्रदेश,नुवाकोट,बेलकोटगढी नगरपालिका,,उपप्रमुख,शिव प्रसाद दाहाल,नेपाली काँग्रेस
बागमती प्रदेश,नुवाकोट,बेलकोटगढी नगरपालिका,,उपप्रमुख,प्रकाश नेपाल,नेपाल कम्युनिष्ट पार्टी (एकिकृत समाजबादी)
