Provience,District,Local Body,Ward No,Post,Candidate,Party
मधेश प्रदेश,बारा,सिम्रौनगढ नगरपालिका,,उपप्रमुख,सुषमा कुमारी यादव,जनमत पार्टी (जपा)
मधेश प्रदेश,बारा,सिम्रौनगढ नगरपालिका,,उपप्रमुख,किरण कुमारी,नेपाल कम्युनिष्ट पार्टी (एमाले)
मधेश प्रदेश,बारा,सिम्रौनगढ नगरपालिका,,उपप्रमुख,पन्नालाल प्रसाद कुशवाहा,"जनता समाजवादी पार्टी, नेपाल"
मधेश प्रदेश,बारा,सिम्रौनगढ नगरपालिका,,उपप्रमुख,नजमु शेहर,"लोकतान्त्रिक समाजवादी पार्टी, नेपाल"
मधेश प्रदेश,बारा,सिम्रौनगढ नगरपालिका,,उपप्रमुख,रुस्दा खातुन,स्वतन्त्र
मधेश प्रदेश,बारा,सिम्रौनगढ नगरपालिका,,उपप्रमुख,फुलझरी देवी यादव,नेपाल कम्युनिष्ट पार्टी (माओवादी केन्द्र)
मधेश प्रदेश,बारा,सिम्रौनगढ नगरपालिका,,उपप्रमुख,रीता कुमारी देवी,नेपाली काँग्रेस
मधेश प्रदेश,बारा,सिम्रौनगढ नगरपालिका,,उपप्रमुख,गजेन्द्र प्रसाद कुशवाहा,नेपाल कम्युनिष्ट पार्टी (एकिकृत समाजबादी)
