Provience,District,Local Body,Ward No,Post,Candidate,Party
मधेश प्रदेश,धनुषा,धनौजी गाउँपालिका,,उपाध्यक्ष,निर्मला देवी,नेपाल कम्युनिष्ट पार्टी (एकिकृत समाजबादी)
मधेश प्रदेश,धनुषा,धनौजी गाउँपालिका,,उपाध्यक्ष,रंजीता देवी मंडल,"लोकतान्त्रिक समाजवादी पार्टी, नेपाल"
मधेश प्रदेश,धनुषा,धनौजी गाउँपालिका,,उपाध्यक्ष,मानती देवी,जनमत पार्टी (जपा)
मधेश प्रदेश,धनुषा,धनौजी गाउँपालिका,,उपाध्यक्ष,प्रेमकान्ती देवी,नेपाल कम्युनिष्ट पार्टी (माओवादी केन्द्र)
मधेश प्रदेश,धनुषा,धनौजी गाउँपालिका,,उपाध्यक्ष,रुवदा खातुन,नेपाल कम्युनिष्ट पार्टी (एमाले)
मधेश प्रदेश,धनुषा,धनौजी गाउँपालिका,,उपाध्यक्ष,रामवती देवी मंडल,नेपाली काँग्रेस
मधेश प्रदेश,धनुषा,धनौजी गाउँपालिका,,उपाध्यक्ष,रन्जीता  देवी दास,बहुजन एकता पार्टी नेपाल
मधेश प्रदेश,धनुषा,धनौजी गाउँपालिका,,उपाध्यक्ष,रिंकु देवी ठाकुर,"जनता समाजवादी पार्टी, नेपाल"
