Provience,District,Local Body,Ward No,Post,Candidate,Party
लुम्बिनी प्रदेश,रोल्पा,त्रिवेणी गाउँपालिका,,अध्यक्ष,लाल बहादुर खत्री,नेपाल कम्युनिष्ट पार्टी (एकिकृत समाजबादी)
लुम्बिनी प्रदेश,रोल्पा,त्रिवेणी गाउँपालिका,,अध्यक्ष,देवी राम खड्का,राष्ट्रिय प्रजातन्त्र पार्टी
लुम्बिनी प्रदेश,रोल्पा,त्रिवेणी गाउँपालिका,,अध्यक्ष,हरी प्रसाद कामी,राष्ट्रिय जनमोर्चा
लुम्बिनी प्रदेश,रोल्पा,त्रिवेणी गाउँपालिका,,अध्यक्ष,कर्ण बहादुर बाँठामगर,नेपाल कम्युनिष्ट पार्टी (एमाले)
लुम्बिनी प्रदेश,रोल्पा,त्रिवेणी गाउँपालिका,,अध्यक्ष,रेशम पुन,नेपाल कम्युनिष्ट पार्टी (माओवादी केन्द्र)
