Provience,District,Local Body,Ward No,Post,Candidate,Party
मधेश प्रदेश,बारा,सुवर्ण गाउँपालिका,,उपाध्यक्ष,ललिता देवी गिरी,नेपाल कम्युनिष्ट पार्टी (माओवादी केन्द्र)
मधेश प्रदेश,बारा,सुवर्ण गाउँपालिका,,उपाध्यक्ष,अनु देवी यादव,नेपाल कम्युनिष्ट पार्टी (एमाले)
मधेश प्रदेश,बारा,सुवर्ण गाउँपालिका,,उपाध्यक्ष,ममता कुमारी यादव,नेपाल कम्युनिष्ट पार्टी (एकिकृत समाजबादी)
मधेश प्रदेश,बारा,सुवर्ण गाउँपालिका,,उपाध्यक्ष,संगिता देवी यादव,जनमत पार्टी (जपा)
मधेश प्रदेश,बारा,सुवर्ण गाउँपालिका,,उपाध्यक्ष,पुनम कुमारी,नेपाली काँग्रेस
मधेश प्रदेश,बारा,सुवर्ण गाउँपालिका,,उपाध्यक्ष,राजपति देवी यादव,"जनता समाजवादी पार्टी, नेपाल"
