Provience,District,Local Body,Ward No,Post,Candidate,Party
मधेश प्रदेश,धनुषा,मुखियापट्टी मुसहरमिया गाउँपालिका,,उपाध्यक्ष,अंजल साह,नेपाल कम्युनिष्ट पार्टी (एमाले)
मधेश प्रदेश,धनुषा,मुखियापट्टी मुसहरमिया गाउँपालिका,,उपाध्यक्ष,सहनाज वेगम खातुन,राष्ट्रिय जनता पार्टी नेपाल
मधेश प्रदेश,धनुषा,मुखियापट्टी मुसहरमिया गाउँपालिका,,उपाध्यक्ष,अनिता कुमारी,नेपाली काँग्रेस
मधेश प्रदेश,धनुषा,मुखियापट्टी मुसहरमिया गाउँपालिका,,उपाध्यक्ष,सैदा खातुन,"जनता समाजवादी पार्टी, नेपाल"
मधेश प्रदेश,धनुषा,मुखियापट्टी मुसहरमिया गाउँपालिका,,उपाध्यक्ष,मुन्नी देवी झा,नेपाल कम्युनिष्ट पार्टी (एकिकृत समाजबादी)
