Provience,District,Local Body,Ward No,Post,Candidate,Party
मधेश प्रदेश,सर्लाही,बसबरिया गाउँपालिका,,उपाध्यक्ष,निभा कुमारी,नेपाली काँग्रेस
मधेश प्रदेश,सर्लाही,बसबरिया गाउँपालिका,,उपाध्यक्ष,राम परि यादव,नेपाल कम्युनिष्ट पार्टी (एमाले)
मधेश प्रदेश,सर्लाही,बसबरिया गाउँपालिका,,उपाध्यक्ष,राकेश कुमार यादव,स्वतन्त्र
मधेश प्रदेश,सर्लाही,बसबरिया गाउँपालिका,,उपाध्यक्ष,चन्द्रकला देवी राय,"लोकतान्त्रिक समाजवादी पार्टी, नेपाल"
मधेश प्रदेश,सर्लाही,बसबरिया गाउँपालिका,,उपाध्यक्ष,सरिता कुमारी,"जनता समाजवादी पार्टी, नेपाल"
