Provience,District,Local Body,Ward No,Post,Candidate,Party
मधेश प्रदेश,सर्लाही,चन्द्रनगर गाउँपालिका,,उपाध्यक्ष,राजन्‍ति पासवान,नेपाल कम्युनिष्ट पार्टी (एमाले)
मधेश प्रदेश,सर्लाही,चन्द्रनगर गाउँपालिका,,उपाध्यक्ष,मंजु देवी,नेपाली काँग्रेस
मधेश प्रदेश,सर्लाही,चन्द्रनगर गाउँपालिका,,उपाध्यक्ष,मंजु कुमारी सुडी,नेपाल संघीय समाजवादी पार्टी
मधेश प्रदेश,सर्लाही,चन्द्रनगर गाउँपालिका,,उपाध्यक्ष,गीता देवी महतो,नेपाल कम्युनिष्ट पार्टी (माओवादी केन्द्र)
मधेश प्रदेश,सर्लाही,चन्द्रनगर गाउँपालिका,,उपाध्यक्ष,राम वती राय दनुवार,"जनता समाजवादी पार्टी, नेपाल"
मधेश प्रदेश,सर्लाही,चन्द्रनगर गाउँपालिका,,उपाध्यक्ष,काजल कुमारी महतो,जनमत पार्टी (जपा)
मधेश प्रदेश,सर्लाही,चन्द्रनगर गाउँपालिका,,उपाध्यक्ष,शर्मिला कुमारी सिंह,नेपाल कम्युनिष्ट पार्टी (एकिकृत समाजबादी)
मधेश प्रदेश,सर्लाही,चन्द्रनगर गाउँपालिका,,उपाध्यक्ष,कुन्ती देवी साह,"लोकतान्त्रिक समाजवादी पार्टी, नेपाल"
