Provience,District,Local Body,Ward No,Post,Candidate,Party
कर्णाली प्रदेश,सल्यान,बागचौर नगरपालिका,,प्रमुख,अम्वर बहादुर गिरी,राष्ट्रिय प्रजातन्त्र पार्टी
कर्णाली प्रदेश,सल्यान,बागचौर नगरपालिका,,प्रमुख,चित्र बहादुर डाँगी क्षेत्री,"जनता समाजवादी पार्टी, नेपाल"
कर्णाली प्रदेश,सल्यान,बागचौर नगरपालिका,,प्रमुख,कृती बहादुर पुन,नेपाल कम्युनिष्ट पार्टी (माओवादी केन्द्र)
कर्णाली प्रदेश,सल्यान,बागचौर नगरपालिका,,प्रमुख,जनक राज गौतम,नेपाली काँग्रेस
कर्णाली प्रदेश,सल्यान,बागचौर नगरपालिका,,प्रमुख,तिलक बहादुर मल्ल,नेपाल कम्युनिष्ट पार्टी (एमाले)
