Provience,District,Local Body,Ward No,Post,Candidate,Party
मधेश प्रदेश,धनुषा,बटेश्वर गाउँपालिका,,उपाध्यक्ष,रेणु कुमारी,नेपाल कम्युनिष्ट पार्टी (एमाले)
मधेश प्रदेश,धनुषा,बटेश्वर गाउँपालिका,,उपाध्यक्ष,प्रमिला देवी,नेपाल कम्युनिष्ट पार्टी (एकिकृत समाजबादी)
मधेश प्रदेश,धनुषा,बटेश्वर गाउँपालिका,,उपाध्यक्ष,रेखा कुमारी महतो,नेपाल कम्युनिष्ट पार्टी (माओवादी केन्द्र)
मधेश प्रदेश,धनुषा,बटेश्वर गाउँपालिका,,उपाध्यक्ष,हिरा कुमारी रविदास,"लोकतान्त्रिक समाजवादी पार्टी, नेपाल"
मधेश प्रदेश,धनुषा,बटेश्वर गाउँपालिका,,उपाध्यक्ष,फुल कुमारी सिंह,नेपाली काँग्रेस
मधेश प्रदेश,धनुषा,बटेश्वर गाउँपालिका,,उपाध्यक्ष,रेनु देवी साह तेली,जनमत पार्टी (जपा)
