Provience,District,Local Body,Ward No,Post,Candidate,Party
बागमती प्रदेश,रसुवा,कालिका गाउँपालिका,,उपाध्यक्ष,विष्‍णु प्रसाद देवकोटा,नेपाल कम्युनिष्ट पार्टी (एकिकृत समाजबादी)
बागमती प्रदेश,रसुवा,कालिका गाउँपालिका,,उपाध्यक्ष,वर्षा तामाङ,मंगोल नेशनल अर्गनाइजेसन
बागमती प्रदेश,रसुवा,कालिका गाउँपालिका,,उपाध्यक्ष,मिरा तमाङ,नेपाली काँग्रेस
बागमती प्रदेश,रसुवा,कालिका गाउँपालिका,,उपाध्यक्ष,यशोदा न्यौपाने,नेपाल कम्युनिष्ट पार्टी (समाजवादी)
बागमती प्रदेश,रसुवा,कालिका गाउँपालिका,,उपाध्यक्ष,अम्बिका भट्ट पौडेल,नेपाल कम्युनिष्ट पार्टी (एमाले)
