Provience,District,Local Body,Ward No,Post,Candidate,Party
प्रदेश १,पाँचथर,फिदिम नगरपालिका,,उपप्रमुख,राधा कृष्ण न्यौपाने,नेपाल कम्युनिष्ट पार्टी (माओवादी केन्द्र)
प्रदेश १,पाँचथर,फिदिम नगरपालिका,,उपप्रमुख,पुण्यमाया घिमिरे (पोख्रेल),नेपाल कम्युनिष्ट पार्टी (मार्क्सवादी लेनिनवादी)
प्रदेश १,पाँचथर,फिदिम नगरपालिका,,उपप्रमुख,सुनिता केरुङ,संघीय लोकतान्त्रिक राष्ट्रिय मञ्च
प्रदेश १,पाँचथर,फिदिम नगरपालिका,,उपप्रमुख,भावना सुब्बा,"जनता समाजवादी पार्टी, नेपाल"
प्रदेश १,पाँचथर,फिदिम नगरपालिका,,उपप्रमुख,जगत प्रसाद थापा मगर,राष्ट्रिय प्रजातन्त्र पार्टी
